20:50:04.514564 IP host.docker.internal.57504 > host.docker.internal.3000: Flags [S], seq 3955323134, win 65495, options [mss 65495,sackOK,TS val 1948128884 ecr 0,nop,wscale 7], length 0
20:50:04.514579 IP host.docker.internal.3000 > host.docker.internal.57504: Flags [S.], seq 1643134548, ack 3955323135, win 65483, options [mss 65495,sackOK,TS val 1948128884 ecr 1948128884,nop,wscale 7], length 0
20:50:04.514590 IP host.docker.internal.57504 > host.docker.internal.3000: Flags [.], ack 1, win 512, options [nop,nop,TS val 1948128884 ecr 1948128884], length 0
20:50:04.515269 IP host.docker.internal.57504 > host.docker.internal.3000: Flags [P.], seq 1:185, ack 1, win 512, options [nop,nop,TS val 1948128884 ecr 1948128884], length 184
20:50:04.515281 IP host.docker.internal.3000 > host.docker.internal.57504: Flags [.], ack 185, win 511, options [nop,nop,TS val 1948128884 ecr 1948128884], length 0
20:50:04.516255 IP host.docker.internal.3000 > host.docker.internal.57504: Flags [P.], seq 1:130, ack 185, win 512, options [nop,nop,TS val 1948128885 ecr 1948128884], length 129
20:50:04.516278 IP host.docker.internal.57504 > host.docker.internal.3000: Flags [.], ack 130, win 511, options [nop,nop,TS val 1948128885 ecr 1948128885], length 0
20:50:04.516761 IP host.docker.internal.57504 > host.docker.internal.3000: Flags [P.], seq 185:209, ack 130, win 512, options [nop,nop,TS val 1948128886 ecr 1948128885], length 24
20:50:04.516772 IP host.docker.internal.3000 > host.docker.internal.57504: Flags [.], ack 209, win 512, options [nop,nop,TS val 1948128886 ecr 1948128886], length 0
20:50:04.517000 IP host.docker.internal.3000 > host.docker.internal.57504: Flags [P.], seq 130:145, ack 209, win 512, options [nop,nop,TS val 1948128886 ecr 1948128886], length 15
20:50:04.517017 IP host.docker.internal.57504 > host.docker.internal.3000: Flags [.], ack 145, win 512, options [nop,nop,TS val 1948128886 ecr 1948128886], length 0
20:50:04.517424 IP host.docker.internal.58414 > host.docker.internal.3001: Flags [S], seq 121095246, win 65495, options [mss 65495,sackOK,TS val 1948128886 ecr 0,nop,wscale 7], length 0
20:50:04.517434 IP host.docker.internal.3001 > host.docker.internal.58414: Flags [S.], seq 3714123025, ack 121095247, win 65483, options [mss 65495,sackOK,TS val 1948128886 ecr 1948128886,nop,wscale 7], length 0
20:50:04.517442 IP host.docker.internal.58414 > host.docker.internal.3001: Flags [.], ack 1, win 512, options [nop,nop,TS val 1948128886 ecr 1948128886], length 0
20:50:04.517982 IP host.docker.internal.58414 > host.docker.internal.3001: Flags [P.], seq 1:185, ack 1, win 512, options [nop,nop,TS val 1948128887 ecr 1948128886], length 184
20:50:04.517992 IP host.docker.internal.3001 > host.docker.internal.58414: Flags [.], ack 185, win 511, options [nop,nop,TS val 1948128887 ecr 1948128887], length 0
20:50:04.518958 IP host.docker.internal.3001 > host.docker.internal.58414: Flags [P.], seq 1:130, ack 185, win 512, options [nop,nop,TS val 1948128888 ecr 1948128887], length 129
20:50:04.519133 IP host.docker.internal.58414 > host.docker.internal.3001: Flags [.], ack 130, win 511, options [nop,nop,TS val 1948128888 ecr 1948128888], length 0
20:50:04.519505 IP host.docker.internal.58414 > host.docker.internal.3001: Flags [P.], seq 185:209, ack 130, win 512, options [nop,nop,TS val 1948128889 ecr 1948128888], length 24
20:50:04.519516 IP host.docker.internal.3001 > host.docker.internal.58414: Flags [.], ack 209, win 512, options [nop,nop,TS val 1948128889 ecr 1948128889], length 0
20:50:04.519747 IP host.docker.internal.3001 > host.docker.internal.58414: Flags [P.], seq 130:147, ack 209, win 512, options [nop,nop,TS val 1948128889 ecr 1948128889], length 17
20:50:04.519812 IP host.docker.internal.58414 > host.docker.internal.3001: Flags [.], ack 147, win 512, options [nop,nop,TS val 1948128889 ecr 1948128889], length 0
20:50:06.364348 IP host.docker.internal.57504 > host.docker.internal.3000: Flags [.], seq 209:32977, ack 145, win 512, options [nop,nop,TS val 1948130733 ecr 1948128886], length 32768
20:50:06.364422 IP host.docker.internal.3000 > host.docker.internal.57504: Flags [.], ack 32977, win 379, options [nop,nop,TS val 1948130733 ecr 1948130733], length 0
20:50:06.364788 IP host.docker.internal.57504 > host.docker.internal.3000: Flags [P.], seq 32977:65745, ack 145, win 512, options [nop,nop,TS val 1948130734 ecr 1948130733], length 32768
20:50:06.364831 IP host.docker.internal.3000 > host.docker.internal.57504: Flags [.], ack 65745, win 379, options [nop,nop,TS val 1948130734 ecr 1948130734], length 0
20:50:06.365011 IP host.docker.internal.57504 > host.docker.internal.3000: Flags [.], seq 65745:98513, ack 145, win 512, options [nop,nop,TS val 1948130734 ecr 1948130734], length 32768
20:50:06.365055 IP host.docker.internal.3000 > host.docker.internal.57504: Flags [.], ack 98513, win 1535, options [nop,nop,TS val 1948130734 ecr 1948130734], length 0
20:50:06.365281 IP host.docker.internal.57504 > host.docker.internal.3000: Flags [P.], seq 98513:163996, ack 145, win 512, options [nop,nop,TS val 1948130734 ecr 1948130734], length 65483
20:50:06.365366 IP host.docker.internal.3000 > host.docker.internal.57504: Flags [.], ack 163996, win 2558, options [nop,nop,TS val 1948130734 ecr 1948130734], length 0
20:50:06.366510 IP host.docker.internal.57504 > host.docker.internal.3000: Flags [.], seq 163996:229479, ack 145, win 512, options [nop,nop,TS val 1948130735 ecr 1948130734], length 65483
20:50:06.366593 IP host.docker.internal.3000 > host.docker.internal.57504: Flags [.], ack 229479, win 3582, options [nop,nop,TS val 1948130736 ecr 1948130735], length 0
20:50:06.367067 IP host.docker.internal.57504 > host.docker.internal.3000: Flags [.], seq 229479:294962, ack 145, win 512, options [nop,nop,TS val 1948130736 ecr 1948130736], length 65483
20:50:06.367138 IP host.docker.internal.3000 > host.docker.internal.57504: Flags [.], ack 294962, win 4605, options [nop,nop,TS val 1948130736 ecr 1948130736], length 0
20:50:06.367393 IP host.docker.internal.57504 > host.docker.internal.3000: Flags [.], seq 294962:360445, ack 145, win 512, options [nop,nop,TS val 1948130736 ecr 1948130736], length 65483
20:50:06.367478 IP host.docker.internal.3000 > host.docker.internal.57504: Flags [.], ack 360445, win 5628, options [nop,nop,TS val 1948130736 ecr 1948130736], length 0
20:50:06.368132 IP host.docker.internal.57504 > host.docker.internal.3000: Flags [.], seq 360445:425928, ack 145, win 512, options [nop,nop,TS val 1948130737 ecr 1948130736], length 65483
20:50:06.368258 IP host.docker.internal.3000 > host.docker.internal.57504: Flags [.], ack 425928, win 6651, options [nop,nop,TS val 1948130737 ecr 1948130737], length 0
20:50:06.368755 IP host.docker.internal.57504 > host.docker.internal.3000: Flags [.], seq 425928:491411, ack 145, win 512, options [nop,nop,TS val 1948130738 ecr 1948130737], length 65483
20:50:06.368827 IP host.docker.internal.3000 > host.docker.internal.57504: Flags [.], ack 491411, win 7674, options [nop,nop,TS val 1948130738 ecr 1948130738], length 0
20:50:06.369052 IP host.docker.internal.57504 > host.docker.internal.3000: Flags [.], seq 491411:556894, ack 145, win 512, options [nop,nop,TS val 1948130738 ecr 1948130738], length 65483
20:50:06.369159 IP host.docker.internal.3000 > host.docker.internal.57504: Flags [.], ack 556894, win 8697, options [nop,nop,TS val 1948130738 ecr 1948130738], length 0
20:50:06.369598 IP host.docker.internal.57504 > host.docker.internal.3000: Flags [.], seq 556894:622377, ack 145, win 512, options [nop,nop,TS val 1948130739 ecr 1948130738], length 65483
20:50:06.369676 IP host.docker.internal.3000 > host.docker.internal.57504: Flags [.], ack 622377, win 9721, options [nop,nop,TS val 1948130739 ecr 1948130739], length 0
20:50:06.370129 IP host.docker.internal.57504 > host.docker.internal.3000: Flags [.], seq 622377:687860, ack 145, win 512, options [nop,nop,TS val 1948130739 ecr 1948130739], length 65483
20:50:06.370201 IP host.docker.internal.3000 > host.docker.internal.57504: Flags [.], ack 687860, win 10744, options [nop,nop,TS val 1948130739 ecr 1948130739], length 0
20:50:06.370461 IP host.docker.internal.57504 > host.docker.internal.3000: Flags [.], seq 687860:753343, ack 145, win 512, options [nop,nop,TS val 1948130739 ecr 1948130739], length 65483
20:50:06.370566 IP host.docker.internal.3000 > host.docker.internal.57504: Flags [.], ack 753343, win 11767, options [nop,nop,TS val 1948130740 ecr 1948130739], length 0
20:50:06.371296 IP host.docker.internal.57504 > host.docker.internal.3000: Flags [.], seq 753343:818826, ack 145, win 512, options [nop,nop,TS val 1948130740 ecr 1948130740], length 65483
20:50:06.371376 IP host.docker.internal.3000 > host.docker.internal.57504: Flags [.], ack 818826, win 12790, options [nop,nop,TS val 1948130740 ecr 1948130740], length 0
20:50:06.371832 IP host.docker.internal.57504 > host.docker.internal.3000: Flags [.], seq 818826:884309, ack 145, win 512, options [nop,nop,TS val 1948130741 ecr 1948130740], length 65483
20:50:06.371976 IP host.docker.internal.3000 > host.docker.internal.57504: Flags [.], ack 884309, win 13813, options [nop,nop,TS val 1948130741 ecr 1948130741], length 0
20:50:06.372363 IP host.docker.internal.57504 > host.docker.internal.3000: Flags [.], seq 884309:949792, ack 145, win 512, options [nop,nop,TS val 1948130741 ecr 1948130741], length 65483
20:50:06.372496 IP host.docker.internal.3000 > host.docker.internal.57504: Flags [.], ack 949792, win 14836, options [nop,nop,TS val 1948130741 ecr 1948130741], length 0
20:50:06.372986 IP host.docker.internal.57504 > host.docker.internal.3000: Flags [.], seq 949792:1015275, ack 145, win 512, options [nop,nop,TS val 1948130742 ecr 1948130741], length 65483
20:50:06.373065 IP host.docker.internal.3000 > host.docker.internal.57504: Flags [.], ack 1015275, win 15860, options [nop,nop,TS val 1948130742 ecr 1948130742], length 0
20:50:06.373500 IP host.docker.internal.57504 > host.docker.internal.3000: Flags [.], seq 1015275:1080758, ack 145, win 512, options [nop,nop,TS val 1948130742 ecr 1948130742], length 65483
20:50:06.373569 IP host.docker.internal.3000 > host.docker.internal.57504: Flags [.], ack 1080758, win 16883, options [nop,nop,TS val 1948130743 ecr 1948130742], length 0
20:50:06.373811 IP host.docker.internal.57504 > host.docker.internal.3000: Flags [.], seq 1080758:1146241, ack 145, win 512, options [nop,nop,TS val 1948130743 ecr 1948130743], length 65483
20:50:06.373895 IP host.docker.internal.3000 > host.docker.internal.57504: Flags [.], ack 1146241, win 17906, options [nop,nop,TS val 1948130743 ecr 1948130743], length 0
20:50:06.374370 IP host.docker.internal.57504 > host.docker.internal.3000: Flags [.], seq 1146241:1211724, ack 145, win 512, options [nop,nop,TS val 1948130743 ecr 1948130743], length 65483
20:50:06.374458 IP host.docker.internal.3000 > host.docker.internal.57504: Flags [.], ack 1211724, win 18929, options [nop,nop,TS val 1948130743 ecr 1948130743], length 0
20:50:06.374837 IP host.docker.internal.57504 > host.docker.internal.3000: Flags [.], seq 1211724:1277207, ack 145, win 512, options [nop,nop,TS val 1948130744 ecr 1948130743], length 65483
20:50:06.374907 IP host.docker.internal.3000 > host.docker.internal.57504: Flags [.], ack 1277207, win 19952, options [nop,nop,TS val 1948130744 ecr 1948130744], length 0
20:50:06.375150 IP host.docker.internal.57504 > host.docker.internal.3000: Flags [.], seq 1277207:1342690, ack 145, win 512, options [nop,nop,TS val 1948130744 ecr 1948130744], length 65483
20:50:06.375234 IP host.docker.internal.3000 > host.docker.internal.57504: Flags [.], ack 1342690, win 20976, options [nop,nop,TS val 1948130744 ecr 1948130744], length 0
20:50:06.376014 IP host.docker.internal.57504 > host.docker.internal.3000: Flags [.], seq 1342690:1408173, ack 145, win 512, options [nop,nop,TS val 1948130745 ecr 1948130744], length 65483
20:50:06.376097 IP host.docker.internal.3000 > host.docker.internal.57504: Flags [.], ack 1408173, win 21999, options [nop,nop,TS val 1948130745 ecr 1948130745], length 0
20:50:06.376499 IP host.docker.internal.57504 > host.docker.internal.3000: Flags [.], seq 1408173:1473656, ack 145, win 512, options [nop,nop,TS val 1948130745 ecr 1948130745], length 65483
20:50:06.376567 IP host.docker.internal.3000 > host.docker.internal.57504: Flags [.], ack 1473656, win 23022, options [nop,nop,TS val 1948130746 ecr 1948130745], length 0
20:50:06.376785 IP host.docker.internal.57504 > host.docker.internal.3000: Flags [.], seq 1473656:1539139, ack 145, win 512, options [nop,nop,TS val 1948130746 ecr 1948130746], length 65483
20:50:06.376896 IP host.docker.internal.3000 > host.docker.internal.57504: Flags [.], ack 1539139, win 24045, options [nop,nop,TS val 1948130746 ecr 1948130746], length 0
20:50:06.377541 IP host.docker.internal.57504 > host.docker.internal.3000: Flags [.], seq 1539139:1604622, ack 145, win 512, options [nop,nop,TS val 1948130746 ecr 1948130746], length 65483
20:50:06.377622 IP host.docker.internal.3000 > host.docker.internal.57504: Flags [.], ack 1604622, win 24316, options [nop,nop,TS val 1948130747 ecr 1948130746], length 0
20:50:06.378087 IP host.docker.internal.57504 > host.docker.internal.3000: Flags [.], seq 1604622:1670105, ack 145, win 512, options [nop,nop,TS val 1948130747 ecr 1948130747], length 65483
20:50:06.378186 IP host.docker.internal.3000 > host.docker.internal.57504: Flags [.], ack 1670105, win 24316, options [nop,nop,TS val 1948130747 ecr 1948130747], length 0
20:50:06.378416 IP host.docker.internal.57504 > host.docker.internal.3000: Flags [P.], seq 1670105:1735588, ack 145, win 512, options [nop,nop,TS val 1948130747 ecr 1948130747], length 65483
20:50:06.378498 IP host.docker.internal.3000 > host.docker.internal.57504: Flags [.], ack 1735588, win 24316, options [nop,nop,TS val 1948130748 ecr 1948130747], length 0
20:50:06.385213 IP host.docker.internal.57504 > host.docker.internal.3000: Flags [.], seq 1735588:1801071, ack 145, win 512, options [nop,nop,TS val 1948130754 ecr 1948130748], length 65483
20:50:06.385313 IP host.docker.internal.3000 > host.docker.internal.57504: Flags [.], ack 1801071, win 24316, options [nop,nop,TS val 1948130754 ecr 1948130754], length 0
20:50:06.386099 IP host.docker.internal.57504 > host.docker.internal.3000: Flags [.], seq 1801071:1866554, ack 145, win 512, options [nop,nop,TS val 1948130755 ecr 1948130754], length 65483
20:50:06.386167 IP host.docker.internal.3000 > host.docker.internal.57504: Flags [.], ack 1866554, win 24316, options [nop,nop,TS val 1948130755 ecr 1948130755], length 0
20:50:06.386434 IP host.docker.internal.57504 > host.docker.internal.3000: Flags [.], seq 1866554:1932037, ack 145, win 512, options [nop,nop,TS val 1948130755 ecr 1948130755], length 65483
20:50:06.386517 IP host.docker.internal.3000 > host.docker.internal.57504: Flags [.], ack 1932037, win 24316, options [nop,nop,TS val 1948130756 ecr 1948130755], length 0
20:50:06.386986 IP host.docker.internal.57504 > host.docker.internal.3000: Flags [.], seq 1932037:1997520, ack 145, win 512, options [nop,nop,TS val 1948130756 ecr 1948130756], length 65483
20:50:06.387067 IP host.docker.internal.3000 > host.docker.internal.57504: Flags [.], ack 1997520, win 24316, options [nop,nop,TS val 1948130756 ecr 1948130756], length 0
20:50:06.387479 IP host.docker.internal.57504 > host.docker.internal.3000: Flags [.], seq 1997520:2063003, ack 145, win 512, options [nop,nop,TS val 1948130756 ecr 1948130756], length 65483
20:50:06.387558 IP host.docker.internal.3000 > host.docker.internal.57504: Flags [.], ack 2063003, win 24316, options [nop,nop,TS val 1948130757 ecr 1948130756], length 0
20:50:06.387795 IP host.docker.internal.57504 > host.docker.internal.3000: Flags [.], seq 2063003:2128486, ack 145, win 512, options [nop,nop,TS val 1948130757 ecr 1948130757], length 65483
20:50:06.387878 IP host.docker.internal.3000 > host.docker.internal.57504: Flags [.], ack 2128486, win 24316, options [nop,nop,TS val 1948130757 ecr 1948130757], length 0
20:50:06.388325 IP host.docker.internal.57504 > host.docker.internal.3000: Flags [.], seq 2128486:2193969, ack 145, win 512, options [nop,nop,TS val 1948130757 ecr 1948130757], length 65483
20:50:06.388405 IP host.docker.internal.3000 > host.docker.internal.57504: Flags [.], ack 2193969, win 24316, options [nop,nop,TS val 1948130757 ecr 1948130757], length 0
20:50:06.388906 IP host.docker.internal.57504 > host.docker.internal.3000: Flags [.], seq 2193969:2259452, ack 145, win 512, options [nop,nop,TS val 1948130758 ecr 1948130757], length 65483
20:50:06.388975 IP host.docker.internal.3000 > host.docker.internal.57504: Flags [.], ack 2259452, win 24316, options [nop,nop,TS val 1948130758 ecr 1948130758], length 0
20:50:06.389207 IP host.docker.internal.57504 > host.docker.internal.3000: Flags [.], seq 2259452:2324935, ack 145, win 512, options [nop,nop,TS val 1948130758 ecr 1948130758], length 65483
20:50:06.389945 IP host.docker.internal.57504 > host.docker.internal.3000: Flags [.], seq 2324935:2390418, ack 145, win 512, options [nop,nop,TS val 1948130759 ecr 1948130758], length 65483
20:50:06.390047 IP host.docker.internal.3000 > host.docker.internal.57504: Flags [.], ack 2390418, win 24316, options [nop,nop,TS val 1948130759 ecr 1948130758], length 0
20:50:06.390446 IP host.docker.internal.57504 > host.docker.internal.3000: Flags [.], seq 2390418:2455901, ack 145, win 512, options [nop,nop,TS val 1948130759 ecr 1948130759], length 65483
20:50:06.390865 IP host.docker.internal.57504 > host.docker.internal.3000: Flags [.], seq 2455901:2521384, ack 145, win 512, options [nop,nop,TS val 1948130760 ecr 1948130759], length 65483
20:50:06.390957 IP host.docker.internal.3000 > host.docker.internal.57504: Flags [.], ack 2521384, win 24316, options [nop,nop,TS val 1948130760 ecr 1948130759], length 0
20:50:06.391400 IP host.docker.internal.57504 > host.docker.internal.3000: Flags [.], seq 2521384:2586867, ack 145, win 512, options [nop,nop,TS val 1948130760 ecr 1948130760], length 65483
20:50:06.392000 IP host.docker.internal.57504 > host.docker.internal.3000: Flags [.], seq 2586867:2652350, ack 145, win 512, options [nop,nop,TS val 1948130761 ecr 1948130760], length 65483
20:50:06.392070 IP host.docker.internal.3000 > host.docker.internal.57504: Flags [.], ack 2652350, win 24316, options [nop,nop,TS val 1948130761 ecr 1948130760], length 0
20:50:06.393366 IP host.docker.internal.57504 > host.docker.internal.3000: Flags [.], seq 2652350:2717833, ack 145, win 512, options [nop,nop,TS val 1948130762 ecr 1948130761], length 65483
20:50:06.393972 IP host.docker.internal.57504 > host.docker.internal.3000: Flags [.], seq 2717833:2783316, ack 145, win 512, options [nop,nop,TS val 1948130763 ecr 1948130761], length 65483
20:50:06.394058 IP host.docker.internal.3000 > host.docker.internal.57504: Flags [.], ack 2783316, win 24316, options [nop,nop,TS val 1948130763 ecr 1948130762], length 0
20:50:06.394467 IP host.docker.internal.57504 > host.docker.internal.3000: Flags [.], seq 2783316:2848799, ack 145, win 512, options [nop,nop,TS val 1948130763 ecr 1948130763], length 65483
20:50:06.396953 IP host.docker.internal.57504 > host.docker.internal.3000: Flags [.], seq 2848799:2914282, ack 145, win 512, options [nop,nop,TS val 1948130766 ecr 1948130763], length 65483
20:50:06.397047 IP host.docker.internal.3000 > host.docker.internal.57504: Flags [.], ack 2914282, win 24316, options [nop,nop,TS val 1948130766 ecr 1948130763], length 0
20:50:06.397546 IP host.docker.internal.57504 > host.docker.internal.3000: Flags [.], seq 2914282:2979765, ack 145, win 512, options [nop,nop,TS val 1948130766 ecr 1948130766], length 65483
20:50:06.398038 IP host.docker.internal.57504 > host.docker.internal.3000: Flags [.], seq 2979765:3045248, ack 145, win 512, options [nop,nop,TS val 1948130767 ecr 1948130766], length 65483
20:50:06.398132 IP host.docker.internal.3000 > host.docker.internal.57504: Flags [.], ack 3045248, win 24316, options [nop,nop,TS val 1948130767 ecr 1948130766], length 0
20:50:06.398375 IP host.docker.internal.57504 > host.docker.internal.3000: Flags [.], seq 3045248:3110731, ack 145, win 512, options [nop,nop,TS val 1948130767 ecr 1948130767], length 65483
20:50:06.398957 IP host.docker.internal.57504 > host.docker.internal.3000: Flags [.], seq 3110731:3176214, ack 145, win 512, options [nop,nop,TS val 1948130768 ecr 1948130767], length 65483
20:50:06.399041 IP host.docker.internal.3000 > host.docker.internal.57504: Flags [.], ack 3176214, win 24316, options [nop,nop,TS val 1948130768 ecr 1948130767], length 0
20:50:06.399496 IP host.docker.internal.57504 > host.docker.internal.3000: Flags [.], seq 3176214:3241697, ack 145, win 512, options [nop,nop,TS val 1948130768 ecr 1948130768], length 65483
20:50:06.399798 IP host.docker.internal.57504 > host.docker.internal.3000: Flags [P.], seq 3241697:3307180, ack 145, win 512, options [nop,nop,TS val 1948130769 ecr 1948130768], length 65483
20:50:06.399890 IP host.docker.internal.3000 > host.docker.internal.57504: Flags [.], ack 3307180, win 24316, options [nop,nop,TS val 1948130769 ecr 1948130768], length 0
20:50:06.400403 IP host.docker.internal.57504 > host.docker.internal.3000: Flags [.], seq 3307180:3372663, ack 145, win 512, options [nop,nop,TS val 1948130769 ecr 1948130769], length 65483
20:50:06.401362 IP host.docker.internal.57504 > host.docker.internal.3000: Flags [.], seq 3372663:3438146, ack 145, win 512, options [nop,nop,TS val 1948130770 ecr 1948130769], length 65483
20:50:06.401432 IP host.docker.internal.3000 > host.docker.internal.57504: Flags [.], ack 3438146, win 24316, options [nop,nop,TS val 1948130770 ecr 1948130769], length 0
20:50:06.401672 IP host.docker.internal.57504 > host.docker.internal.3000: Flags [.], seq 3438146:3503629, ack 145, win 512, options [nop,nop,TS val 1948130771 ecr 1948130770], length 65483
20:50:06.402603 IP host.docker.internal.57504 > host.docker.internal.3000: Flags [.], seq 3503629:3569112, ack 145, win 512, options [nop,nop,TS val 1948130772 ecr 1948130770], length 65483
20:50:06.402686 IP host.docker.internal.3000 > host.docker.internal.57504: Flags [.], ack 3569112, win 24316, options [nop,nop,TS val 1948130772 ecr 1948130771], length 0
20:50:06.403079 IP host.docker.internal.57504 > host.docker.internal.3000: Flags [.], seq 3569112:3634595, ack 145, win 512, options [nop,nop,TS val 1948130772 ecr 1948130772], length 65483
20:50:06.403833 IP host.docker.internal.57504 > host.docker.internal.3000: Flags [.], seq 3634595:3700078, ack 145, win 512, options [nop,nop,TS val 1948130773 ecr 1948130772], length 65483
20:50:06.403924 IP host.docker.internal.3000 > host.docker.internal.57504: Flags [.], ack 3700078, win 24316, options [nop,nop,TS val 1948130773 ecr 1948130772], length 0
20:50:06.404362 IP host.docker.internal.57504 > host.docker.internal.3000: Flags [.], seq 3700078:3765561, ack 145, win 512, options [nop,nop,TS val 1948130773 ecr 1948130773], length 65483
20:50:06.405119 IP host.docker.internal.57504 > host.docker.internal.3000: Flags [.], seq 3765561:3831044, ack 145, win 512, options [nop,nop,TS val 1948130774 ecr 1948130773], length 65483
20:50:06.405189 IP host.docker.internal.3000 > host.docker.internal.57504: Flags [.], ack 3831044, win 24316, options [nop,nop,TS val 1948130774 ecr 1948130773], length 0
20:50:06.405679 IP host.docker.internal.57504 > host.docker.internal.3000: Flags [.], seq 3831044:3896527, ack 145, win 512, options [nop,nop,TS val 1948130775 ecr 1948130774], length 65483
20:50:06.406342 IP host.docker.internal.57504 > host.docker.internal.3000: Flags [.], seq 3896527:3962010, ack 145, win 512, options [nop,nop,TS val 1948130775 ecr 1948130774], length 65483
20:50:06.406426 IP host.docker.internal.3000 > host.docker.internal.57504: Flags [.], ack 3962010, win 24316, options [nop,nop,TS val 1948130775 ecr 1948130775], length 0
20:50:06.409021 IP host.docker.internal.57504 > host.docker.internal.3000: Flags [.], seq 3962010:4027493, ack 145, win 512, options [nop,nop,TS val 1948130778 ecr 1948130775], length 65483
20:50:06.409439 IP host.docker.internal.57504 > host.docker.internal.3000: Flags [.], seq 4027493:4092976, ack 145, win 512, options [nop,nop,TS val 1948130778 ecr 1948130775], length 65483
20:50:06.409534 IP host.docker.internal.3000 > host.docker.internal.57504: Flags [.], ack 4092976, win 24316, options [nop,nop,TS val 1948130779 ecr 1948130778], length 0
20:50:06.410137 IP host.docker.internal.57504 > host.docker.internal.3000: Flags [.], seq 4092976:4158459, ack 145, win 512, options [nop,nop,TS val 1948130779 ecr 1948130779], length 65483
20:50:06.410839 IP host.docker.internal.57504 > host.docker.internal.3000: Flags [.], seq 4158459:4223942, ack 145, win 512, options [nop,nop,TS val 1948130780 ecr 1948130779], length 65483
20:50:06.410912 IP host.docker.internal.3000 > host.docker.internal.57504: Flags [.], ack 4223942, win 24316, options [nop,nop,TS val 1948130780 ecr 1948130779], length 0
20:50:06.411159 IP host.docker.internal.57504 > host.docker.internal.3000: Flags [.], seq 4223942:4289425, ack 145, win 512, options [nop,nop,TS val 1948130780 ecr 1948130780], length 65483
20:50:06.411743 IP host.docker.internal.57504 > host.docker.internal.3000: Flags [.], seq 4289425:4354908, ack 145, win 512, options [nop,nop,TS val 1948130781 ecr 1948130780], length 65483
20:50:06.411886 IP host.docker.internal.3000 > host.docker.internal.57504: Flags [.], ack 4354908, win 24316, options [nop,nop,TS val 1948130781 ecr 1948130780], length 0
20:50:06.413216 IP host.docker.internal.57504 > host.docker.internal.3000: Flags [.], seq 4354908:4420391, ack 145, win 512, options [nop,nop,TS val 1948130782 ecr 1948130781], length 65483
20:50:06.413551 IP host.docker.internal.57504 > host.docker.internal.3000: Flags [.], seq 4420391:4485874, ack 145, win 512, options [nop,nop,TS val 1948130782 ecr 1948130781], length 65483
20:50:06.413645 IP host.docker.internal.3000 > host.docker.internal.57504: Flags [.], ack 4485874, win 24316, options [nop,nop,TS val 1948130783 ecr 1948130782], length 0
20:50:06.414168 IP host.docker.internal.57504 > host.docker.internal.3000: Flags [.], seq 4485874:4551357, ack 145, win 512, options [nop,nop,TS val 1948130783 ecr 1948130783], length 65483
20:50:06.414999 IP host.docker.internal.57504 > host.docker.internal.3000: Flags [P.], seq 4551357:4552843, ack 145, win 512, options [nop,nop,TS val 1948130784 ecr 1948130783], length 1486
20:50:06.415010 IP host.docker.internal.3000 > host.docker.internal.57504: Flags [.], ack 4552843, win 24566, options [nop,nop,TS val 1948130784 ecr 1948130783], length 0
20:50:07.082710 IP host.docker.internal.3000 > host.docker.internal.57504: Flags [P.], seq 145:172, ack 4552843, win 24566, options [nop,nop,TS val 1948131452 ecr 1948130783], length 27
20:50:07.082721 IP host.docker.internal.57504 > host.docker.internal.3000: Flags [.], ack 172, win 512, options [nop,nop,TS val 1948131452 ecr 1948131452], length 0
20:50:07.083453 IP host.docker.internal.57504 > host.docker.internal.3000: Flags [P.], seq 4552843:4580409, ack 172, win 512, options [nop,nop,TS val 1948131452 ecr 1948131452], length 27566
20:50:07.083503 IP host.docker.internal.3000 > host.docker.internal.57504: Flags [.], ack 4580409, win 24464, options [nop,nop,TS val 1948131453 ecr 1948131452], length 0
20:50:07.087886 IP host.docker.internal.3000 > host.docker.internal.57504: Flags [P.], seq 172:199, ack 4580409, win 24566, options [nop,nop,TS val 1948131457 ecr 1948131452], length 27
20:50:07.087896 IP host.docker.internal.57504 > host.docker.internal.3000: Flags [.], ack 199, win 512, options [nop,nop,TS val 1948131457 ecr 1948131457], length 0
20:50:07.169840 IP host.docker.internal.58414 > host.docker.internal.3001: Flags [.], seq 209:32977, ack 147, win 512, options [nop,nop,TS val 1948131539 ecr 1948128889], length 32768
20:50:07.169887 IP host.docker.internal.3001 > host.docker.internal.58414: Flags [.], ack 32977, win 379, options [nop,nop,TS val 1948131539 ecr 1948131539], length 0
20:50:07.170267 IP host.docker.internal.58414 > host.docker.internal.3001: Flags [P.], seq 32977:65745, ack 147, win 512, options [nop,nop,TS val 1948131539 ecr 1948131539], length 32768
20:50:07.170308 IP host.docker.internal.3001 > host.docker.internal.58414: Flags [.], ack 65745, win 379, options [nop,nop,TS val 1948131539 ecr 1948131539], length 0
20:50:07.170483 IP host.docker.internal.58414 > host.docker.internal.3001: Flags [.], seq 65745:98513, ack 147, win 512, options [nop,nop,TS val 1948131539 ecr 1948131539], length 32768
20:50:07.170527 IP host.docker.internal.3001 > host.docker.internal.58414: Flags [.], ack 98513, win 1535, options [nop,nop,TS val 1948131540 ecr 1948131539], length 0
20:50:07.171442 IP host.docker.internal.58414 > host.docker.internal.3001: Flags [P.], seq 98513:163996, ack 147, win 512, options [nop,nop,TS val 1948131540 ecr 1948131540], length 65483
20:50:07.171515 IP host.docker.internal.3001 > host.docker.internal.58414: Flags [.], ack 163996, win 2558, options [nop,nop,TS val 1948131541 ecr 1948131540], length 0
20:50:07.171775 IP host.docker.internal.58414 > host.docker.internal.3001: Flags [.], seq 163996:229479, ack 147, win 512, options [nop,nop,TS val 1948131541 ecr 1948131541], length 65483
20:50:07.171861 IP host.docker.internal.3001 > host.docker.internal.58414: Flags [.], ack 229479, win 3582, options [nop,nop,TS val 1948131541 ecr 1948131541], length 0
20:50:07.172459 IP host.docker.internal.58414 > host.docker.internal.3001: Flags [.], seq 229479:294962, ack 147, win 512, options [nop,nop,TS val 1948131541 ecr 1948131541], length 65483
20:50:07.172540 IP host.docker.internal.3001 > host.docker.internal.58414: Flags [.], ack 294962, win 4605, options [nop,nop,TS val 1948131542 ecr 1948131541], length 0
20:50:07.172966 IP host.docker.internal.58414 > host.docker.internal.3001: Flags [.], seq 294962:360445, ack 147, win 512, options [nop,nop,TS val 1948131542 ecr 1948131542], length 65483
20:50:07.173048 IP host.docker.internal.3001 > host.docker.internal.58414: Flags [.], ack 360445, win 5628, options [nop,nop,TS val 1948131542 ecr 1948131542], length 0
20:50:07.173324 IP host.docker.internal.58414 > host.docker.internal.3001: Flags [.], seq 360445:425928, ack 147, win 512, options [nop,nop,TS val 1948131542 ecr 1948131542], length 65483
20:50:07.173409 IP host.docker.internal.3001 > host.docker.internal.58414: Flags [.], ack 425928, win 6651, options [nop,nop,TS val 1948131542 ecr 1948131542], length 0
20:50:07.173839 IP host.docker.internal.58414 > host.docker.internal.3001: Flags [.], seq 425928:491411, ack 147, win 512, options [nop,nop,TS val 1948131543 ecr 1948131542], length 65483
20:50:07.173948 IP host.docker.internal.3001 > host.docker.internal.58414: Flags [.], ack 491411, win 7674, options [nop,nop,TS val 1948131543 ecr 1948131543], length 0
20:50:07.174333 IP host.docker.internal.58414 > host.docker.internal.3001: Flags [.], seq 491411:556894, ack 147, win 512, options [nop,nop,TS val 1948131543 ecr 1948131543], length 65483
20:50:07.174403 IP host.docker.internal.3001 > host.docker.internal.58414: Flags [.], ack 556894, win 8697, options [nop,nop,TS val 1948131543 ecr 1948131543], length 0
20:50:07.174682 IP host.docker.internal.58414 > host.docker.internal.3001: Flags [.], seq 556894:622377, ack 147, win 512, options [nop,nop,TS val 1948131544 ecr 1948131543], length 65483
20:50:07.174764 IP host.docker.internal.3001 > host.docker.internal.58414: Flags [.], ack 622377, win 9721, options [nop,nop,TS val 1948131544 ecr 1948131544], length 0
20:50:07.175205 IP host.docker.internal.58414 > host.docker.internal.3001: Flags [.], seq 622377:687860, ack 147, win 512, options [nop,nop,TS val 1948131544 ecr 1948131544], length 65483
20:50:07.175287 IP host.docker.internal.3001 > host.docker.internal.58414: Flags [.], ack 687860, win 10744, options [nop,nop,TS val 1948131544 ecr 1948131544], length 0
20:50:07.175689 IP host.docker.internal.58414 > host.docker.internal.3001: Flags [.], seq 687860:753343, ack 147, win 512, options [nop,nop,TS val 1948131545 ecr 1948131544], length 65483
20:50:07.175802 IP host.docker.internal.3001 > host.docker.internal.58414: Flags [.], ack 753343, win 11767, options [nop,nop,TS val 1948131545 ecr 1948131545], length 0
20:50:07.176046 IP host.docker.internal.58414 > host.docker.internal.3001: Flags [.], seq 753343:818826, ack 147, win 512, options [nop,nop,TS val 1948131545 ecr 1948131545], length 65483
20:50:07.176131 IP host.docker.internal.3001 > host.docker.internal.58414: Flags [.], ack 818826, win 12790, options [nop,nop,TS val 1948131545 ecr 1948131545], length 0
20:50:07.176651 IP host.docker.internal.58414 > host.docker.internal.3001: Flags [.], seq 818826:884309, ack 147, win 512, options [nop,nop,TS val 1948131546 ecr 1948131545], length 65483
20:50:07.176731 IP host.docker.internal.3001 > host.docker.internal.58414: Flags [.], ack 884309, win 13813, options [nop,nop,TS val 1948131546 ecr 1948131546], length 0
20:50:07.177277 IP host.docker.internal.58414 > host.docker.internal.3001: Flags [.], seq 884309:949792, ack 147, win 512, options [nop,nop,TS val 1948131546 ecr 1948131546], length 65483
20:50:07.177349 IP host.docker.internal.3001 > host.docker.internal.58414: Flags [.], ack 949792, win 14836, options [nop,nop,TS val 1948131546 ecr 1948131546], length 0
20:50:07.177585 IP host.docker.internal.58414 > host.docker.internal.3001: Flags [.], seq 949792:1015275, ack 147, win 512, options [nop,nop,TS val 1948131547 ecr 1948131546], length 65483
20:50:07.177697 IP host.docker.internal.3001 > host.docker.internal.58414: Flags [.], ack 1015275, win 15860, options [nop,nop,TS val 1948131547 ecr 1948131547], length 0
20:50:07.178156 IP host.docker.internal.58414 > host.docker.internal.3001: Flags [.], seq 1015275:1080758, ack 147, win 512, options [nop,nop,TS val 1948131547 ecr 1948131547], length 65483
20:50:07.178238 IP host.docker.internal.3001 > host.docker.internal.58414: Flags [.], ack 1080758, win 16883, options [nop,nop,TS val 1948131547 ecr 1948131547], length 0
20:50:07.178652 IP host.docker.internal.58414 > host.docker.internal.3001: Flags [.], seq 1080758:1146241, ack 147, win 512, options [nop,nop,TS val 1948131548 ecr 1948131547], length 65483
20:50:07.178726 IP host.docker.internal.3001 > host.docker.internal.58414: Flags [.], ack 1146241, win 17906, options [nop,nop,TS val 1948131548 ecr 1948131548], length 0
20:50:07.179004 IP host.docker.internal.58414 > host.docker.internal.3001: Flags [.], seq 1146241:1211724, ack 147, win 512, options [nop,nop,TS val 1948131548 ecr 1948131548], length 65483
20:50:07.179106 IP host.docker.internal.3001 > host.docker.internal.58414: Flags [.], ack 1211724, win 18929, options [nop,nop,TS val 1948131548 ecr 1948131548], length 0
20:50:07.179722 IP host.docker.internal.58414 > host.docker.internal.3001: Flags [.], seq 1211724:1277207, ack 147, win 512, options [nop,nop,TS val 1948131549 ecr 1948131548], length 65483
20:50:07.179802 IP host.docker.internal.3001 > host.docker.internal.58414: Flags [.], ack 1277207, win 19952, options [nop,nop,TS val 1948131549 ecr 1948131549], length 0
20:50:07.180218 IP host.docker.internal.58414 > host.docker.internal.3001: Flags [.], seq 1277207:1342690, ack 147, win 512, options [nop,nop,TS val 1948131549 ecr 1948131549], length 65483
20:50:07.180288 IP host.docker.internal.3001 > host.docker.internal.58414: Flags [.], ack 1342690, win 20976, options [nop,nop,TS val 1948131549 ecr 1948131549], length 0
20:50:07.180531 IP host.docker.internal.58414 > host.docker.internal.3001: Flags [.], seq 1342690:1408173, ack 147, win 512, options [nop,nop,TS val 1948131549 ecr 1948131549], length 65483
20:50:07.180613 IP host.docker.internal.3001 > host.docker.internal.58414: Flags [.], ack 1408173, win 21999, options [nop,nop,TS val 1948131550 ecr 1948131549], length 0
20:50:07.181064 IP host.docker.internal.58414 > host.docker.internal.3001: Flags [.], seq 1408173:1473656, ack 147, win 512, options [nop,nop,TS val 1948131550 ecr 1948131550], length 65483
20:50:07.181148 IP host.docker.internal.3001 > host.docker.internal.58414: Flags [.], ack 1473656, win 23022, options [nop,nop,TS val 1948131550 ecr 1948131550], length 0
20:50:07.181587 IP host.docker.internal.58414 > host.docker.internal.3001: Flags [.], seq 1473656:1539139, ack 147, win 512, options [nop,nop,TS val 1948131551 ecr 1948131550], length 65483
20:50:07.181659 IP host.docker.internal.3001 > host.docker.internal.58414: Flags [.], ack 1539139, win 24045, options [nop,nop,TS val 1948131551 ecr 1948131551], length 0
20:50:07.181906 IP host.docker.internal.58414 > host.docker.internal.3001: Flags [.], seq 1539139:1604622, ack 147, win 512, options [nop,nop,TS val 1948131551 ecr 1948131551], length 65483
20:50:07.182012 IP host.docker.internal.3001 > host.docker.internal.58414: Flags [.], ack 1604622, win 24316, options [nop,nop,TS val 1948131551 ecr 1948131551], length 0
20:50:07.182573 IP host.docker.internal.58414 > host.docker.internal.3001: Flags [.], seq 1604622:1670105, ack 147, win 512, options [nop,nop,TS val 1948131552 ecr 1948131551], length 65483
20:50:07.182686 IP host.docker.internal.3001 > host.docker.internal.58414: Flags [.], ack 1670105, win 24316, options [nop,nop,TS val 1948131552 ecr 1948131552], length 0
20:50:07.183385 IP host.docker.internal.58414 > host.docker.internal.3001: Flags [P.], seq 1670105:1735588, ack 147, win 512, options [nop,nop,TS val 1948131552 ecr 1948131552], length 65483
20:50:07.183454 IP host.docker.internal.3001 > host.docker.internal.58414: Flags [.], ack 1735588, win 24316, options [nop,nop,TS val 1948131552 ecr 1948131552], length 0
20:50:07.183757 IP host.docker.internal.58414 > host.docker.internal.3001: Flags [.], seq 1735588:1801071, ack 147, win 512, options [nop,nop,TS val 1948131553 ecr 1948131552], length 65483
20:50:07.183897 IP host.docker.internal.3001 > host.docker.internal.58414: Flags [.], ack 1801071, win 24316, options [nop,nop,TS val 1948131553 ecr 1948131553], length 0
20:50:07.184443 IP host.docker.internal.58414 > host.docker.internal.3001: Flags [.], seq 1801071:1866554, ack 147, win 512, options [nop,nop,TS val 1948131553 ecr 1948131553], length 65483
20:50:07.184613 IP host.docker.internal.3001 > host.docker.internal.58414: Flags [.], ack 1866554, win 24316, options [nop,nop,TS val 1948131554 ecr 1948131553], length 0
20:50:07.185061 IP host.docker.internal.58414 > host.docker.internal.3001: Flags [.], seq 1866554:1932037, ack 147, win 512, options [nop,nop,TS val 1948131554 ecr 1948131554], length 65483
20:50:07.185277 IP host.docker.internal.3001 > host.docker.internal.58414: Flags [.], ack 1932037, win 24316, options [nop,nop,TS val 1948131554 ecr 1948131554], length 0
20:50:07.185600 IP host.docker.internal.58414 > host.docker.internal.3001: Flags [.], seq 1932037:1997520, ack 147, win 512, options [nop,nop,TS val 1948131555 ecr 1948131554], length 65483
20:50:07.185702 IP host.docker.internal.3001 > host.docker.internal.58414: Flags [.], ack 1997520, win 24316, options [nop,nop,TS val 1948131555 ecr 1948131555], length 0
20:50:07.186315 IP host.docker.internal.58414 > host.docker.internal.3001: Flags [.], seq 1997520:2063003, ack 147, win 512, options [nop,nop,TS val 1948131555 ecr 1948131555], length 65483
20:50:07.186452 IP host.docker.internal.3001 > host.docker.internal.58414: Flags [.], ack 2063003, win 24316, options [nop,nop,TS val 1948131555 ecr 1948131555], length 0
20:50:07.186915 IP host.docker.internal.58414 > host.docker.internal.3001: Flags [.], seq 2063003:2128486, ack 147, win 512, options [nop,nop,TS val 1948131556 ecr 1948131555], length 65483
20:50:07.187030 IP host.docker.internal.3001 > host.docker.internal.58414: Flags [.], ack 2128486, win 24316, options [nop,nop,TS val 1948131556 ecr 1948131556], length 0
